{
    "$schema": "../../src/open_prime_hunters_rando/files/schema.json",
    "configuration_id": 206913146,
    "starting_items": {
        "weapons": {
            "battlehammer": false,
            "imperialist": false,
            "judicator": false,
            "magmaul": false,
            "missile_launcher": false,
            "shock_coil": false,
            "volt_driver": false
        },
        "missiles": 0,
        "ammo": 40,
        "energy": 99,
        "octoliths": "11110000",
        "artifacts": {
            "alinos_1": "000",
            "alinos_2": "000",
            "celestial_archives_1": "000",
            "celestial_archives_2": "000",
            "vesper_defense_outpost_1": "000",
            "vesper_defense_outpost_2": "000",
            "arcterra_1": "000",
            "arcterra_2": "000"
        }
    },
    "areas": {
        "Celestial Archives": {
            "levels": {
                "Biodefense Chamber A": {
                    "pickups": [
                        {
                            "entity_id": 8,
                            "entity_type": 17,
                            "model_id": 1,
                            "artifact_id": 1
                        }
                    ],
                    "force_fields": [],
                    "portals": []
                },
                "Biodefense Chamber B": {
                    "pickups": [
                        {
                            "entity_id": 2,
                            "entity_type": 17,
                            "model_id": 8,
                            "artifact_id": 0
                        }
                    ],
                    "force_fields": [],
                    "portals": []
                },
                "Helm Room": {
                    "pickups": [],
                    "force_fields": [],
                    "portals": []
                },
                "Meditation Room": {
                    "pickups": [],
                    "force_fields": [],
                    "portals": []
                },
                "Fan Room Alpha": {
                    "pickups": [],
                    "force_fields": [],
                    "portals": []
                },
                "Fan Room Beta": {
                    "pickups": [],
                    "force_fields": [],
                    "portals": []
                },
                "Synergy Core": {
                    "pickups": [
                        {
                            "entity_id": 3,
                            "entity_type": 4,
                            "item_type": 18
                        }
                    ],
                    "force_fields": [
                        {
                            "entity_id": 15,
                            "type": 1
                        }
                    ],
                    "portals": [
                        {
                            "entity_id": 2,
                            "target_index": 2,
                            "entity_file_name": "Unit2_TP1_Ent"
                        },
                        {
                            "entity_id": 7,
                            "target_index": 10,
                            "entity_file_name": "unit2_RM4_Ent"
                        },
                        {
                            "entity_id": 38,
                            "target_index": 20,
                            "entity_file_name": "unit2_Land_Ent"
                        }
                    ]
                },
                "Tetra Vista": {
                    "pickups": [],
                    "force_fields": [],
                    "portals": [
                        {
                            "entity_id": 1,
                            "target_index": 31,
                            "entity_file_name": "unit2_RM7_Ent"
                        }
                    ]
                },
                "New Arrival Registration": {
                    "pickups": [
                        {
                            "entity_id": 19,
                            "entity_type": 17,
                            "model_id": 2,
                            "artifact_id": 2
                        },
                        {
                            "entity_id": 21,
                            "entity_type": 17,
                            "model_id": 0,
                            "artifact_id": 1
                        }
                    ],
                    "force_fields": [],
                    "portals": [
                        {
                            "entity_id": 24,
                            "target_index": 3,
                            "entity_file_name": "Unit2_TP2_Ent"
                        },
                        {
                            "entity_id": 41,
                            "target_index": 21,
                            "entity_file_name": "unit2_Land_Ent"
                        }
                    ]
                },
                "Celestial Gateway": {
                    "pickups": [
                        {
                            "entity_id": 21,
                            "entity_type": 17,
                            "model_id": 5,
                            "artifact_id": 2
                        }
                    ],
                    "force_fields": [
                        {
                            "entity_id": 20,
                            "type": 3
                        }
                    ],
                    "portals": [
                        {
                            "entity_id": 15,
                            "target_index": 20,
                            "entity_file_name": "unit2_C4_Ent"
                        },
                        {
                            "entity_id": 16,
                            "target_index": 21,
                            "entity_file_name": "unit2_C7_Ent"
                        }
                    ]
                },
                "Data Shrine 01": {
                    "pickups": [
                        {
                            "entity_id": 2,
                            "entity_type": 4,
                            "item_type": 4
                        },
                        {
                            "entity_id": 14,
                            "entity_type": 4,
                            "item_type": 18
                        }
                    ],
                    "force_fields": [],
                    "portals": []
                },
                "Data Shrine 02": {
                    "pickups": [
                        {
                            "entity_id": 14,
                            "entity_type": 4,
                            "item_type": 6
                        },
                        {
                            "entity_id": 18,
                            "entity_type": 4,
                            "item_type": 18
                        },
                        {
                            "entity_id": 41,
                            "entity_type": 4,
                            "item_type": 5
                        }
                    ],
                    "force_fields": [],
                    "portals": []
                },
                "Data Shrine 03": {
                    "pickups": [
                        {
                            "entity_id": 2,
                            "entity_type": 4,
                            "item_type": 4
                        }
                    ],
                    "force_fields": [],
                    "portals": []
                },
                "Transfer Lock": {
                    "pickups": [
                        {
                            "entity_id": 64,
                            "entity_type": 4,
                            "item_type": 6
                        }
                    ],
                    "force_fields": [],
                    "portals": [
                        {
                            "entity_id": 3,
                            "target_index": 10,
                            "entity_file_name": "unit2_C4_Ent"
                        },
                        {
                            "entity_id": 15,
                            "target_index": 12,
                            "entity_file_name": "unit2_RM8_Ent"
                        }
                    ]
                },
                "Incubation Vault 01": {
                    "pickups": [
                        {
                            "entity_id": 10,
                            "entity_type": 17,
                            "model_id": 1,
                            "artifact_id": 0
                        }
                    ],
                    "force_fields": [
                        {
                            "entity_id": 4,
                            "type": 7
                        }
                    ],
                    "portals": [
                        {
                            "entity_id": 2,
                            "target_index": 50,
                            "entity_file_name": "unit2_RM8_Ent"
                        },
                        {
                            "entity_id": 3,
                            "target_index": 26,
                            "entity_file_name": "unit2_RM6_Ent"
                        },
                        {
                            "entity_id": 7,
                            "target_index": 19,
                            "entity_file_name": "unit2_RM5_Ent"
                        },
                        {
                            "entity_id": 9,
                            "target_index": 18,
                            "entity_file_name": "unit2_RM5_Ent"
                        },
                        {